{
  "schema_version": "1.1.0",
  "reviewed_at": "2026-08-28",
  "display_scope": "cc_by_sa_4_0_with_attribution",
  "items": [
    {
      "source_registry_id": "rpi-product-pi-5",
      "product_model": "Raspberry Pi 5",
      "product_page_url": "https://www.raspberrypi.com/products/raspberry-pi-5/",
      "image_url": "https://raw.githubusercontent.com/raspberrypi/documentation/75331a79fbf32d2403b7547729ddccf553873b09/documentation/asciidoc/computers/raspberry-pi/images/5.jpg",
      "source_file": "documentation/asciidoc/computers/raspberry-pi/images/5.jpg",
      "source_commit": "75331a79fbf32d2403b7547729ddccf553873b09",
      "alt_text": "Raspberry Pi 5 board.",
      "source_owner": "Raspberry Pi Ltd",
      "license_id": "CC-BY-SA-4.0",
      "display_status": "cc_by_sa_4_0",
      "attribution": "Raspberry Pi Ltd, Raspberry Pi documentation, CC BY-SA 4.0. Source: https://github.com/raspberrypi/documentation/blob/75331a79fbf32d2403b7547729ddccf553873b09/documentation/asciidoc/computers/raspberry-pi/images/5.jpg",
      "checked_at": "2026-08-28",
      "remote_only": false,
      "cache_permitted": true,
      "git_commit_permitted": true,
      "transform_permitted": true,
      "public_deployment_permitted": true
    },
    {
      "source_registry_id": "rpi-product-pi-4-model-b",
      "product_model": "Raspberry Pi 4 Model B",
      "product_page_url": "https://www.raspberrypi.com/products/raspberry-pi-4-model-b/",
      "image_url": "https://raw.githubusercontent.com/raspberrypi/documentation/75331a79fbf32d2403b7547729ddccf553873b09/documentation/asciidoc/computers/raspberry-pi/images/4-model-b.jpg",
      "source_file": "documentation/asciidoc/computers/raspberry-pi/images/4-model-b.jpg",
      "source_commit": "75331a79fbf32d2403b7547729ddccf553873b09",
      "alt_text": "Raspberry Pi 4 Model B board.",
      "source_owner": "Raspberry Pi Ltd",
      "license_id": "CC-BY-SA-4.0",
      "display_status": "cc_by_sa_4_0",
      "attribution": "Raspberry Pi Ltd, Raspberry Pi documentation, CC BY-SA 4.0. Source: https://github.com/raspberrypi/documentation/blob/75331a79fbf32d2403b7547729ddccf553873b09/documentation/asciidoc/computers/raspberry-pi/images/4-model-b.jpg",
      "checked_at": "2026-08-28",
      "remote_only": false,
      "cache_permitted": true,
      "git_commit_permitted": true,
      "transform_permitted": true,
      "public_deployment_permitted": true
    },
    {
      "source_registry_id": "rpi-product-pi-500",
      "product_model": "Raspberry Pi 500",
      "product_page_url": "https://www.raspberrypi.com/products/raspberry-pi-500/",
      "image_url": "https://raw.githubusercontent.com/raspberrypi/documentation/75331a79fbf32d2403b7547729ddccf553873b09/documentation/asciidoc/computers/raspberry-pi/images/500.png",
      "source_file": "documentation/asciidoc/computers/raspberry-pi/images/500.png",
      "source_commit": "75331a79fbf32d2403b7547729ddccf553873b09",
      "alt_text": "Raspberry Pi 500 keyboard computer.",
      "source_owner": "Raspberry Pi Ltd",
      "license_id": "CC-BY-SA-4.0",
      "display_status": "cc_by_sa_4_0",
      "attribution": "Raspberry Pi Ltd, Raspberry Pi documentation, CC BY-SA 4.0. Source: https://github.com/raspberrypi/documentation/blob/75331a79fbf32d2403b7547729ddccf553873b09/documentation/asciidoc/computers/raspberry-pi/images/500.png",
      "checked_at": "2026-08-28",
      "remote_only": false,
      "cache_permitted": true,
      "git_commit_permitted": true,
      "transform_permitted": true,
      "public_deployment_permitted": true
    },
    {
      "source_registry_id": "rpi-product-pi-400",
      "product_model": "Raspberry Pi 400",
      "product_page_url": "https://www.raspberrypi.com/products/raspberry-pi-400/",
      "image_url": "https://raw.githubusercontent.com/raspberrypi/documentation/75331a79fbf32d2403b7547729ddccf553873b09/documentation/asciidoc/computers/raspberry-pi/images/400.jpg",
      "source_file": "documentation/asciidoc/computers/raspberry-pi/images/400.jpg",
      "source_commit": "75331a79fbf32d2403b7547729ddccf553873b09",
      "alt_text": "Raspberry Pi 400 keyboard computer.",
      "source_owner": "Raspberry Pi Ltd",
      "license_id": "CC-BY-SA-4.0",
      "display_status": "cc_by_sa_4_0",
      "attribution": "Raspberry Pi Ltd, Raspberry Pi documentation, CC BY-SA 4.0. Source: https://github.com/raspberrypi/documentation/blob/75331a79fbf32d2403b7547729ddccf553873b09/documentation/asciidoc/computers/raspberry-pi/images/400.jpg",
      "checked_at": "2026-08-28",
      "remote_only": false,
      "cache_permitted": true,
      "git_commit_permitted": true,
      "transform_permitted": true,
      "public_deployment_permitted": true
    },
    {
      "source_registry_id": "rpi-product-zero-2-w",
      "product_model": "Raspberry Pi Zero 2 W",
      "product_page_url": "https://www.raspberrypi.com/products/raspberry-pi-zero-2-w/",
      "image_url": "https://raw.githubusercontent.com/raspberrypi/documentation/75331a79fbf32d2403b7547729ddccf553873b09/documentation/asciidoc/computers/raspberry-pi/images/zero-2-w.jpg",
      "source_file": "documentation/asciidoc/computers/raspberry-pi/images/zero-2-w.jpg",
      "source_commit": "75331a79fbf32d2403b7547729ddccf553873b09",
      "alt_text": "Raspberry Pi Zero 2 W board.",
      "source_owner": "Raspberry Pi Ltd",
      "license_id": "CC-BY-SA-4.0",
      "display_status": "cc_by_sa_4_0",
      "attribution": "Raspberry Pi Ltd, Raspberry Pi documentation, CC BY-SA 4.0. Source: https://github.com/raspberrypi/documentation/blob/75331a79fbf32d2403b7547729ddccf553873b09/documentation/asciidoc/computers/raspberry-pi/images/zero-2-w.jpg",
      "checked_at": "2026-08-28",
      "remote_only": false,
      "cache_permitted": true,
      "git_commit_permitted": true,
      "transform_permitted": true,
      "public_deployment_permitted": true
    }
  ]
}
